{"accepted_repository_commit":"ff5613075c1e73d66e487381566e33dbfc6778f4","collection_production_identity_recipe":{"collection_output_namespace":"pipelines/brisbane_baylands/task_06_recovery_v1/06g/replay_v34/document_publications","collection_spec_destination":"task06g_collection_only_v1.json","destination":"collection_production_identity.json","imported_selection_destination":"task06g_imported_document_selection_v1.json","schema_version":"er_commons.task06g.collection_production_identity_recipe.v1","source_catalog_ref":{"authority":"artifact_root","byte_size":20412,"path":"pipelines/brisbane_baylands/task_06_recovery_v1/06g/replay_v32/inputs/task06g_source_family_catalog_v1.json","sha256":"e6d1e631a42260545a8dc0eabb32dddd4e99b8b5472fd3de2f681ff23ee39b56"},"source_policy_refs":[{"authority":"repository","byte_size":697,"path":"configs/brisbane_baylands_2025_deir_task03g2_resolution_policy_v1.json","sha256":"95804a823684792d18467534c2e09f4b0d283bd3405933e9f85515860f692186"},{"authority":"repository","byte_size":526,"path":"configs/brisbane_baylands_2025_deir_task03g2_target_policy_v1.json","sha256":"981b4ff1783286bacaa7cdfa5d10c38920e1575e573757a869e85bf57a241f81"}]},"data_root":"${ER_COMMONS_DATA_ROOT}","generator_files":[{"authority":"repository","byte_size":902,"path":"scripts/finalize_task06g_readiness.py","sha256":"9847da5afb6b2657d6cb8f00f09d57161d1e0f63d3f8ae0a060f3223a557c178"},{"authority":"repository","byte_size":677,"path":"scripts/generate_task06g_collection_configs.py","sha256":"2ce9bbd28fea2d79d25960454d44287f11665e522d5125f033223852432b59bd"},{"authority":"repository","byte_size":1061,"path":"scripts/generate_task06g_imported_selection.py","sha256":"4049d3ff06f50c2d9b3e59ab84a954927fa1b596ae13cf357052a623ab3aad1e"},{"authority":"repository","byte_size":1104,"path":"scripts/launch_task06g_initial.py","sha256":"39a459cc98e3e550a0cd662570b384d8e927c3a9011ba3970ff785d685cd44f1"},{"authority":"repository","byte_size":524,"path":"scripts/launch_task06g_resume.py","sha256":"de116f09aec4c141c0690d7a341b098982fc96d359ffb7e959d97fc802d566cb"},{"authority":"repository","byte_size":867,"path":"scripts/preflight_task06g_prelaunch.py","sha256":"dd28333018bb50c500e483df66ad0c5530b958ade3a9853598b6b9e079069b2e"},{"authority":"repository","byte_size":945,"path":"scripts/preflight_task06g_resume.py","sha256":"58db8730953779cbc16891fcd8774b85d1c2a1deea4a39591220966b58c3b0b5"},{"authority":"repository","byte_size":953,"path":"scripts/resolve_task06g_specs.py","sha256":"47b8e1bcbbaba942645a97062c453cea815c7355cb47dea579f6257f1e687ce0"},{"authority":"repository","byte_size":677,"path":"scripts/run_task06g_replay.py","sha256":"cc332ab48a70a80fdb1c21e98c2d84c636f98a98fd2839be63695d73c1bb1600"},{"authority":"repository","byte_size":10916,"path":"src/er_commons/artifact_io.py","sha256":"742def5e35aa9a29f747149a06d77daf44106ddd5ce50c157181e19f6561236f"},{"authority":"repository","byte_size":5158,"path":"src/er_commons/artifact_verification.py","sha256":"13ffacb60a3d1329fb2b024d89faae09760c46dd1de1f0ba4092b4e3ee2d9719"},{"authority":"repository","byte_size":3611,"path":"src/er_commons/authority_reference.py","sha256":"96479851390dfd13e6e67d70c011ff200324c65b12556f35cbb5242d2fed4260"},{"authority":"repository","byte_size":12916,"path":"src/er_commons/cli.py","sha256":"a991554795bfdf5c9fea44dcf2f6fb51e223dfb8b852a7227ecbe9603d7a3a20"},{"authority":"repository","byte_size":826,"path":"src/er_commons/collection_processing/__init__.py","sha256":"8a642f3f43ae65b67d9440b13b7e2c9c98bf1680abe0831fdaea2ca86bbede20"},{"authority":"repository","byte_size":3624,"path":"src/er_commons/collection_processing/accounting.py","sha256":"d5072f25dc844b70a319490be10d32a0419804b27ae00dbe8909b55f4f39be43"},{"authority":"repository","byte_size":1938,"path":"src/er_commons/collection_processing/artifact_reader.py","sha256":"ef97c263ecfd0058db13cd3dc5e835083c7e33ad0e9dc83e5cdde1e0b4213119"},{"authority":"repository","byte_size":6464,"path":"src/er_commons/collection_processing/attempt_storage.py","sha256":"1da2c2a21e280a448a8dbba0afe30d1e830f79ee13e3d2f4dc8ce5a24004bef2"},{"authority":"repository","byte_size":8118,"path":"src/er_commons/collection_processing/attempts.py","sha256":"8b14888e0519a8deb32a9f9e60ead2d67f8f26ab1488ad16d2bb0759914004bf"},{"authority":"repository","byte_size":11957,"path":"src/er_commons/collection_processing/authority_refs.py","sha256":"3c5f899e52922644517a8942aed3aeea797c6bf72b929c1db50c51e3600f4545"},{"authority":"repository","byte_size":7708,"path":"src/er_commons/collection_processing/bundle.py","sha256":"a55d1d905a8749d33398eff28d7a164809011019ecea5d99f90d72116a1ad52e"},{"authority":"repository","byte_size":1874,"path":"src/er_commons/collection_processing/compatibility_v1.py","sha256":"102767c0d67f32b4f5564ecfc083184de0fbfcfee709d5a3fbce192e7c558593"},{"authority":"repository","byte_size":7886,"path":"src/er_commons/collection_processing/config.py","sha256":"1166c86e49b9c63111368610673662357c75bf346858c37905f63bd8628234af"},{"authority":"repository","byte_size":4808,"path":"src/er_commons/collection_processing/contract.py","sha256":"c0111f077fdbcdd74c4a1aeb1163a5fdc1cc07fc7a6701d08fd5f2ad8ff8d2ab"},{"authority":"repository","byte_size":1848,"path":"src/er_commons/collection_processing/contract_validation.py","sha256":"1aedaebe35b7aec3739d43dd1008e2604282f307c28cd93cbf906cdd023b7a9f"},{"authority":"repository","byte_size":7330,"path":"src/er_commons/collection_processing/cross_document_linking.py","sha256":"ae468ed6be1a00156fbc4b499abca56d4f0b97c6c53d63a07916a86416677b9b"},{"authority":"repository","byte_size":5697,"path":"src/er_commons/collection_processing/cross_document_resolver.py","sha256":"438593755449f9277754a38f03d118c7acf1502955a0c86d625dbf971c959a12"},{"authority":"repository","byte_size":4642,"path":"src/er_commons/collection_processing/document_evidence.py","sha256":"6dd1c296cf9386d31971acdc566ff871c93b0d0ed0db8aca4b9cd3c0d123cbb7"},{"authority":"repository","byte_size":2146,"path":"src/er_commons/collection_processing/document_targets.py","sha256":"5eb4d5e8ce7feade900827dda9e2f1f4e62e16473d70b2137a2560e34804e966"},{"authority":"repository","byte_size":2123,"path":"src/er_commons/collection_processing/domain.py","sha256":"2c4a3dc9351914572068bb1c7c7521f6423bae755f656a3ccf66d2856a2229e4"},{"authority":"repository","byte_size":5359,"path":"src/er_commons/collection_processing/handoff_assembly.py","sha256":"c3ccc4933b116046f76d947d64ddfa10b2b4ba19f12ac15810e99f0871346967"},{"authority":"repository","byte_size":6897,"path":"src/er_commons/collection_processing/handoff_validation.py","sha256":"5a0d5999e7a3eb6cecccb2617f649734f5af32b605de3ea0c0c7f378e98257cd"},{"authority":"repository","byte_size":9463,"path":"src/er_commons/collection_processing/handoff_validation_v3.py","sha256":"47a11fceae4f520c55d0b48dd060cbb3f44bb538ba6fa0eabf74ef2c2b676179"},{"authority":"repository","byte_size":4566,"path":"src/er_commons/collection_processing/imported_evidence.py","sha256":"fd12f10676624a086eceaa2810c267c8fd77c01138f6212113f8e20d33c9587f"},{"authority":"repository","byte_size":8488,"path":"src/er_commons/collection_processing/imported_preflight.py","sha256":"4fa32768b40c6630dc9941febe1eb7b7b3005fee24f8ec0fb3088d85d4083d63"},{"authority":"repository","byte_size":7829,"path":"src/er_commons/collection_processing/imported_selection.py","sha256":"bb65572724ebe89b3145476cdee0e205dc96d5e969e66e2a9f18a0b6be5ef2b5"},{"authority":"repository","byte_size":1908,"path":"src/er_commons/collection_processing/index_identity.py","sha256":"f96d11f44ddbdab1810a504599df6828e3d08d53dc325ebe535635050e618b9c"},{"authority":"repository","byte_size":5058,"path":"src/er_commons/collection_processing/legacy_preflight.py","sha256":"93e8a7fb98f2bb84db9184b94a0ac7050fd870f8b79d1745c19898f985578483"},{"authority":"repository","byte_size":6142,"path":"src/er_commons/collection_processing/mentions.py","sha256":"4ea79f96c384bddc5c802a474a4493a60ee309c488755f7b1f4dd2fc90c26644"},{"authority":"repository","byte_size":8106,"path":"src/er_commons/collection_processing/pipeline.py","sha256":"45d75ae177517dd672407617e649e16cfe7015a477cd7db29b2fe07485b50e01"},{"authority":"repository","byte_size":3162,"path":"src/er_commons/collection_processing/preflight.py","sha256":"a262cd3f30016d735226c2b3e445a535e1391a43d3649835c9d645a1d2d79762"},{"authority":"repository","byte_size":8736,"path":"src/er_commons/collection_processing/production_identity.py","sha256":"2c37f8f1d3f3c18aad780fb835319c9f4651db6fb9bff5fcea83c4f38d7053ad"},{"authority":"repository","byte_size":5328,"path":"src/er_commons/collection_processing/publication.py","sha256":"de875b1f28506d77490da8a4bec4cce920f993b80768c7f0f3513b4853c67997"},{"authority":"repository","byte_size":8582,"path":"src/er_commons/collection_processing/record_target_indexing.py","sha256":"c05cf5da6dbcbe23aa737afc614566766f866ed07ec4847219b1c708d8960a72"},{"authority":"repository","byte_size":7140,"path":"src/er_commons/collection_processing/selection_generation.py","sha256":"75e43b457b73369858f5c686faa2c98bbf0801dd93959d1876dbfe367ff62c36"},{"authority":"repository","byte_size":5841,"path":"src/er_commons/collection_processing/selection_models.py","sha256":"2a327e23c534808f44cd1b23461bc9bd94308041719988b303b57fda65f210bd"},{"authority":"repository","byte_size":10351,"path":"src/er_commons/collection_processing/semantic_validation.py","sha256":"d2c8f7f2a4215ffa23d0d0e4303018e4d278fa787125c3635b8605fc459ab99c"},{"authority":"repository","byte_size":10425,"path":"src/er_commons/collection_processing/semantic_validation_v3.py","sha256":"808f85141e4c9546b00023edb73dc9e3ab5ae689e2658e8e92eabd0cc81156c1"},{"authority":"repository","byte_size":1140,"path":"src/er_commons/collection_processing/source_family_inputs.py","sha256":"12e669bdb2b453dadb554feb522619067c3b26818d5eae602072b609e48f9e17"},{"authority":"repository","byte_size":8501,"path":"src/er_commons/collection_processing/source_membership.py","sha256":"56def8cf852fc40f1ccbd33c5a